{
  "id": "f0003",
  "kind": "range_grid",
  "sensors": [
    "head",
    "head.tex"
  ],
  "timestamp": "2026-10-13T08:01:04Z",
  "status": "deleted",
  "grid": {
    "width": 4,
    "height": 4
  },
  "payloads": [
    {
      "role": "geometry",
      "path": "mesh.ply"
    },
    {
      "role": "texture",
      "path": "texture.png",
      "sensor": "head.tex"
    }
  ],
  "ply_properties": {
    "grid_index": "row-major sensor grid cell (spec 6.3.2)"
  },
  "vendor_properties": {
    "name": "frame_f0003"
  },
  "vendor_raw_properties": [
    {
      "id": "0x0000002a",
      "encoding": "hex",
      "value": "01000000"
    }
  ]
}
